{
  "$schema": "../../registry-item.schema.json",
  "name": "outbox-abstractions",
  "type": "outlet:contract",
  "concern": "outbox",
  "description": "Generic transactional-outbox port (IOutboxStore) and message model — zero external dependency.",
  "targetFrameworks": ["net8.0", "net9.0", "net10.0"],
  "registryDependencies": [],
  "nugetDependencies": [],
  "files": [
    { "path": "IOutboxStore.cs", "target": "contract" },
    { "path": "OutboxMessage.cs", "target": "contract" }
  ]
}
