{
  "$schema": "../../registry-item.schema.json",
  "name": "resilience-abstractions",
  "type": "outlet:contract",
  "concern": "resilience",
  "description": "Generic resilience port (IResilienceExecutor) + options and rejection type — zero external dependency.",
  "targetFrameworks": ["net8.0", "net9.0", "net10.0"],
  "registryDependencies": [],
  "nugetDependencies": [],
  "files": [
    { "path": "IResilienceExecutor.cs", "target": "contract" },
    { "path": "ResilienceBackoff.cs", "target": "contract" },
    { "path": "ResilienceOptions.cs", "target": "contract" },
    { "path": "ResilienceRejectedException.cs", "target": "contract" }
  ]
}
